{
  "api_version": "0.1",
  "request_id": "TYPE-compare_runs",
  "project_id": "P1",
  "scope": {
    "kind": "project"
  },
  "operation": "compare_runs",
  "params": {
    "run_ids": [
      "R1",
      "R2"
    ],
    "metric_scope": {
      "keys": [
        "accepted_quantity"
      ],
      "objects": [],
      "acceptance": []
    }
  }
}
